North China	Yinshan Dykes—combined result	9544	40.5	113.0	32.3	248.3	2.0	1	1	1	c	1	1	1	7	1769	1766	1772	Xu et al. (includes data from Halls et al., 2000)	2014	Field test doesn’t guarantee primary
Rio de la Plata	Playa Hermosa glacial clastics	9520	−34.8	304.7	−58.8	183.1	12.1	1	0	1	0	1	0	0	3	594	578	610	Rapalini et al.	2015	Q2, Q4
Sao Francisco	Salvador dykes—An comp.	9142	−12.9	321.6	−6.4	302.7	15.6	1	1	1	C	1	0	0	5	924	920	928	D’Agrella-Filho et al. (age: Evans et al., 2016a)	2004	Individually not as strong as the two-polarity A-pole
Siberia−east	Ust−Kirba Formation combined	8936	58.7	136.7	8.1	2.6	10.4	1	0	1	0	1	0	1	4	945	930	960	Pavlov et al.	2002	Q2, Q4
Siberia−east	Kandyk Formation combined	8935	59.4	136.4	3.1	356.5	4.3	1	1	1	0	1	0	1	5	975	950	1000	Pavlov et al.	2002	Q4
Siberia−east	Ignican Formation—combined result	8841	58.7	135.2	16.0	21.4	7.4	1	0	1	0	1	0	1	4	1013	1000	1025	Pavlov et al.	2000	Q2, Q4; age constraints from whole-rock Pb/Pb on carbonate
Siberia−east	Nelkan Formation—combined result	8844	58.3	135.6	14.4	39.1	6.3	1	0	1	0	1	0	1	4	1013	1000	1025	Pavlov et al.	2000	Q2, Q4; age constraints from whole-rock Pb/Pb on carbonate
Siberia−east	Milkon Formation—combined result	8847	58.1	135.5	5.6	15.9	3.8	1	1	1	0	1	0	1	5	1025	985	1065	Pavlov et al.	2000	Q4; age constraints somewhat lax
Siberia−east	Kumakha Formation	8848	58.9	135.1	13.9	21.2	7.0	0	0	1	0	1	0	1	3	1040	985	1095	Pavlov et al.	2000	Q1
Siberia−east	Malgina Formation	8571	58.3	135.0	25.4	50.5	2.6	0	1	1	f	1	1	1	6	1050	1000	1120	Gallet et al. (max age: Khudoley et al., 2015)	2000	Q1
Siberia−east−Aldan	Ulkan granite	9500	56.3	134.5	42.1	249.4	4.4	1	1	1	0	0	0	1	4	1719	1709	1729	Didenko et al.	2015	Q4, Q5
Siberia−west	Linok Formation	8572	66.0	88.4	15.2	76.2	7.5	0	1	1	f	1	1	1	6	1050	1000	1120	Gallet et al.	2000	Q1
Siberia−west	Kartochka Formation—magnetite comp.	9609–9610	58.7	97.0	19.1	36.3	11.8	0	1	1	f	1	0	1	5	1050	1000	1120	Gallet et al.	2012	Q1
Siberia−west	North Anabar Intrusions	9553	71.7	106.8	23.9	255.3	7.5	1	1	1	c	1	0	1	5	1483	1466	1500	Evans et al.	2016b	Field test doesn’t guarantee primary
Siberia−west	Kuonamka Dykes	8554	70.0	110.0	−6.0	54.0	19.8	1	0	1	0	1	1	1	5	1503	1498	1508	Ernst et al. (age: Ernst et al., 2016)	2000	Q2, Q4
Siberia−west−Tungus	Shumikhinsk Granitoids	9224	52.1	103.8	−24.9	106.6	5.2	1	0	1	0	0	1	1	4	1851	1843	1858	Didenko et al. (age: Shcherbakova et al., 2006)	2003	Q2, Q4, Q5
South China	Upper Liantuo Formation—combined result	apx. 9534	30.8	111.1	13.2	155.2	5.3	0	1	1	M	1	1	1	6	750	660	767	Jing et al. (includes data from Evans et al., 2000)	2015	Q1
South China	Xiaofeng Dykes—C2 comp.	9117	31.0	111.2	13.5	91.0	10.9	1	1	1	0	1	1	1	6	802	792	812	Li et al.	2004	Q4
South China	Yanbian “A” Dykes	apx. 9526	26.9	101.5	45.1	130.4	19.0	1	1	1	c	0	1	1	6	824	818	820	Niu et al.	2016	Q5
Tarim	Beiyixi (Baiyisi) Fm	9330	41.6	86.5	−17.7	14.2	4.2	1	1	1	0	1	0	1	5	755	740	760	Huang et al. (age: Xu et al., 2009)	2005	Q4
West Africa	Djebel Boho—pole B2	9902	30.4	353.3	27.3	27.1	14.9	1	1	1	f	0	1	1	6	536	526	547	Robert et al.	2017	Q5; also, complex magnetizations in study area
West Africa	Tadoughast and Fajjoud Formations, upper Ouarzazate Group—pole B1	9901	30.2	352.2	21.9	31.0	15.6	1	1	1	fG	0	1	1	6	561	551	572	Robert et al.	2017	Q5; also, complex magnetizations in study area
West Africa	Adrar-n-Takoucht Formation, basal Ouarzazate Group—pole C	9903	30.5	352.2	−57.6	295.6	15.7	1	0	1	f	0	1	1	5	570	564	577	Robert et al.	2017	Q2, Q5; also, complex magnetizations in study area
